{
  "$schema": "https://json-schema.org/draft/2020-12/schema",
  "$id": "https://github.com/pawisssh/design/skills/contract/contract.schema.json",
  "title": "Contract (component.json), schemaVersion 1",
  "description": "Structure of a Contract. The cross-field rules (patterns name real axes, the expansion equals expectedCount, every selected variant resolves, tokens sit inside their variable's scopes, approval matches) are in validate() of scripts/contract.mjs; see references/contract-schema.md#validation.",
  "type": "object",
  "required": ["schemaVersion", "family", "source", "axes", "excluded", "selection", "anatomy", "properties", "layout", "paint", "subComponents", "dependencies", "figma", "code"],
  "properties": {
    "schemaVersion": { "const": 1 },
    "family": {
      "type": "object",
      "required": ["key", "name", "description"],
      "properties": {
        "key": { "type": "string", "pattern": "^[a-z][a-z0-9-]*$" },
        "name": { "type": "string" },
        "description": { "type": "string" }
      }
    },
    "source": {
      "type": "object",
      "required": ["codeLibrary", "adapter", "packages", "files", "snapshotId"],
      "properties": {
        "codeLibrary": { "type": "string" },
        "adapter": { "type": "string" },
        "repository": { "type": "string" },
        "tag": { "type": "string" },
        "commit": { "type": "string", "pattern": "^[0-9a-f]{40}$" },
        "packages": { "type": "object", "additionalProperties": { "type": "string" } },
        "files": { "type": "object", "additionalProperties": { "$ref": "#/$defs/sha256" } },
        "snapshotId": { "$ref": "#/$defs/sha256" }
      }
    },
    "axes": { "type": "array", "minItems": 1, "items": { "$ref": "#/$defs/axis" } },
    "excluded": {
      "type": "array",
      "items": {
        "type": "object",
        "required": ["match", "reason", "evidence"],
        "properties": {
          "match": { "$ref": "#/$defs/pattern" },
          "reason": { "type": "string", "minLength": 1 },
          "evidence": { "type": "array", "minItems": 1, "items": { "type": "string" } }
        }
      }
    },
    "selection": {
      "type": "object",
      "required": ["status", "omit", "expectedCount", "approval"],
      "properties": {
        "status": { "enum": ["draft", "approved"] },
        "omit": {
          "type": "array",
          "items": {
            "type": "object",
            "required": ["match"],
            "properties": { "match": { "$ref": "#/$defs/pattern" }, "reason": { "type": "string" } }
          }
        },
        "expectedCount": { "type": "integer", "minimum": 1 },
        "approval": {
          "anyOf": [
            { "type": "null" },
            {
              "type": "object",
              "required": ["by", "at", "snapshotId", "contentHash"],
              "properties": {
                "by": { "const": "owner" },
                "at": { "type": "string" },
                "snapshotId": { "$ref": "#/$defs/sha256" },
                "contentHash": { "$ref": "#/$defs/sha256" }
              }
            }
          ]
        }
      }
    },
    "anatomy": { "$ref": "#/$defs/node" },
    "properties": { "type": "array", "items": { "$ref": "#/$defs/property" } },
    "layout": { "type": "array", "items": { "$ref": "#/$defs/rule" } },
    "paint": { "type": "array", "items": { "$ref": "#/$defs/rule" } },
    "icons": {
      "type": "object",
      "required": ["source", "default", "preferred"],
      "properties": {
        "source": { "type": "object", "required": ["package", "version", "path"] },
        "default": { "type": "string" },
        "preferred": { "type": "array", "minItems": 1, "items": { "type": "string" } }
      }
    },
    "subComponents": { "type": "array", "items": { "type": "object", "required": ["name", "tier", "anatomy"], "properties": { "name": { "type": "string", "pattern": "^_" }, "tier": { "enum": ["item", "base"] } } } },
    "dependencies": {
      "type": "object",
      "required": ["families", "fonts"],
      "properties": {
        "families": { "type": "array", "items": { "type": "object", "required": ["key", "contract"] } },
        "fonts": { "type": "array", "items": { "type": "object", "required": ["family", "styles"] } }
      }
    },
    "figma": {
      "type": "object",
      "required": ["page", "componentSetName", "description", "header", "grid"],
      "properties": {
        "header": { "type": "object", "required": ["type", "title", "namespace"] },
        "grid": {
          "type": "object",
          "required": ["columns", "rows"],
          "properties": { "columns": { "type": "array", "items": { "type": "string" } }, "rows": { "type": "array", "items": { "type": "string" } } }
        }
      }
    },
    "code": {
      "type": "object",
      "required": ["framework", "package", "component", "import", "alwaysEmit"],
      "properties": {
        "alwaysEmit": { "type": "array", "items": { "type": "string" } },
        "required": { "type": "array", "items": { "type": "string" }, "description": "props the component requires that no axis value or property sets, such as id (#93); whoever renders or emits the component supplies them" },
        "items": {
          "type": "object",
          "required": ["component", "props"],
          "description": "the family's Repeated child (#93): each child is one <component> with these props, listed by a Handoff Usage, never by the Contract",
          "properties": {
            "component": { "type": "string" },
            "props": { "type": "array", "minItems": 1, "items": { "type": "string" } }
          }
        }
      }
    },
    "notes": { "type": "array", "items": { "$ref": "#/$defs/note" } },
    "drafted": {
      "description": "Drafted values (ADR 0010), keyed by value path such as axes.size.values.lg.label or layout.Button.width. A value with no entry is exact. validate() rule 9 checks that every key names a value in the Contract.",
      "type": "object",
      "additionalProperties": { "anyOf": [{ "$ref": "#/$defs/draftedByAgent" }, { "$ref": "#/$defs/draftedByOwner" }] }
    }
  },
  "$defs": {
    "sha256": { "type": "string", "pattern": "^sha256:[0-9a-f]{64}$" },
    "axis": {
      "type": "object",
      "required": ["key", "label", "default", "defaultSource", "values"],
      "properties": {
        "key": { "type": "string" },
        "label": { "type": "string" },
        "default": { "type": "string" },
        "defaultSource": { "type": "string" },
        "canonical": { "type": "boolean" },
        "slot": { "type": "string", "description": "a Slot axis (#121, ADR 0011): the non-root anatomy node whose presence this axis sets; each value says whether it fills it" },
        "values": {
          "type": "array",
          "minItems": 1,
          "items": {
            "type": "object",
            "required": ["key", "label"],
            "properties": {
              "key": { "type": "string" },
              "label": { "type": "string", "pattern": "^[^=,]+$" },
              "code": { "type": ["object", "null"] },
              "css": { "type": "string" },
              "filled": { "type": "boolean", "description": "on a Slot axis value only: whether the slot is filled" }
            }
          }
        },
        "dropped": { "type": "array", "items": { "type": "object", "required": ["key", "reason", "evidence"] } }
      }
    },
    "pattern": {
      "description": "Axis key to a value key (string) or any of several (array). A missing axis matches every value.",
      "type": "object",
      "additionalProperties": { "anyOf": [{ "type": "string" }, { "type": "array", "minItems": 1, "items": { "type": "string" } }] }
    },
    "node": {
      "type": "object",
      "required": ["name", "type"],
      "properties": {
        "name": { "type": "string", "pattern": "^[^/.]+$" },
        "type": { "enum": ["COMPONENT", "FRAME", "TEXT", "INSTANCE", "ELLIPSE"], "description": "ELLIPSE (#442): a stroked circle or arc below the root, with no children; its stroke lies inside its box" },
        "role": { "type": "string" },
        "instanceOf": { "type": "string", "pattern": "^(icon|family|sub):.+$" },
        "children": { "type": "array", "items": { "$ref": "#/$defs/node" } }
      }
    },
    "property": {
      "type": "object",
      "required": ["key", "label", "type", "default", "binds"],
      "properties": {
        "key": { "type": "string" },
        "label": { "type": "string" },
        "type": { "enum": ["TEXT", "BOOLEAN", "INSTANCE_SWAP"] },
        "binds": {
          "type": "array",
          "minItems": 1,
          "items": {
            "type": "object",
            "required": ["node", "field"],
            "properties": { "match": { "$ref": "#/$defs/pattern" }, "node": { "type": "string" }, "field": { "type": "string" } }
          }
        },
        "code": {
          "type": "object",
          "properties": {
            "prop": { "type": "string" },
            "itemProp": { "type": "string", "description": "on a TEXT property: the prop of code.items whose text it shows (#93)" }
          }
        }
      }
    },
    "rule": {
      "type": "object",
      "required": ["match", "set"],
      "properties": {
        "match": { "$ref": "#/$defs/pattern" },
        "set": {
          "description": "Anatomy node name (or <instance>/<layer> path) to fields.",
          "type": "object",
          "additionalProperties": {
            "type": "object",
            "properties": {
              "visible": { "type": "boolean", "description": "layout only: whether the node shows (#93); never on the root" },
              "direction": { "type": "string", "enum": ["row", "column", "none"], "description": "row or column (Auto Layout), or none: no Auto Layout, children at the top left in anatomy order, later on top; a FRAME without direction is none (#442)" },
              "position": { "const": "absolute", "description": "layout only (#442): outside the parent's Auto Layout flow; absent is in flow. Needs constraints, a fixed width and height, a parent with Auto Layout; never on the root" },
              "constraints": { "$ref": "#/$defs/constraints" },
              "arc": { "$ref": "#/$defs/arc" },
              "strokeCap": { "enum": ["round", "none"], "description": "layout only, on an ELLIPSE (#442)" }
            },
            "additionalProperties": { "$ref": "#/$defs/fieldValue" }
          }
        }
      }
    },
    "constraints": {
      "description": "layout only, on an absolute node (#442): where it sits in its parent. Only center for now",
      "type": "object",
      "required": ["horizontal", "vertical"],
      "properties": { "horizontal": { "enum": ["center"] }, "vertical": { "enum": ["center"] } }
    },
    "arc": {
      "description": "layout only, on an ELLIPSE (#442): degrees, 0 at 12 o'clock, positive clockwise; 0 < sweep <= 360, and 360 is a full circle",
      "type": "object",
      "required": ["start", "sweep"],
      "properties": { "start": { "type": "number" }, "sweep": { "type": "number" } }
    },
    "fieldValue": {
      "anyOf": [
        { "type": "string", "description": "a keyword: none, hug, fill, fixed, row, column, start, center, end, space-between, inside, …" },
        { "type": "number" },
        { "$ref": "#/$defs/token" },
        { "$ref": "#/$defs/raw" },
        { "type": "object", "required": ["sameAs"], "properties": { "sameAs": { "type": "string", "pattern": "^.+\\.[A-Za-z]+$" } } },
        { "type": "array", "items": { "$ref": "#/$defs/effect" } }
      ]
    },
    "token": {
      "type": "object",
      "required": ["token"],
      "properties": {
        "token": { "type": "string", "description": "the Code Library's flat token name, never a Figma id" },
        "by": { "const": "owner" },
        "was": { "$ref": "#/$defs/previous" }
      }
    },
    "raw": {
      "type": "object",
      "required": ["raw", "level", "reason"],
      "properties": {
        "raw": { "type": ["number", "string"] },
        "level": { "enum": ["info", "warning"] },
        "reason": { "type": "string", "minLength": 1 },
        "by": { "const": "owner" },
        "was": { "$ref": "#/$defs/previous" }
      }
    },
    "previous": {
      "description": "An owner edit's replaced value: {token} or {raw}. History only; ignored by closure and raw checks.",
      "type": "object",
      "anyOf": [{ "required": ["token"] }, { "required": ["raw"] }]
    },
    "effect": {
      "type": "object",
      "required": ["type"],
      "properties": {
        "type": { "enum": ["inner-shadow", "drop-shadow"] },
        "spread": { "$ref": "#/$defs/fieldValue" },
        "blur": { "$ref": "#/$defs/fieldValue" },
        "x": { "$ref": "#/$defs/fieldValue" },
        "y": { "$ref": "#/$defs/fieldValue" },
        "color": { "$ref": "#/$defs/fieldValue" }
      }
    },
    "draftedByAgent": {
      "type": "object",
      "required": ["by", "evidence", "fingerprint"],
      "properties": {
        "by": { "const": "agent" },
        "evidence": { "type": "array", "minItems": 1, "items": { "type": "string", "minLength": 1 } },
        "fingerprint": { "$ref": "#/$defs/sha256" }
      }
    },
    "draftedByOwner": {
      "type": "object",
      "required": ["by", "was"],
      "properties": { "by": { "type": "string", "pattern": "^owner( \\(simulated[^)]*\\))?$" } }
    },
    "note": {
      "type": "object",
      "required": ["level", "message"],
      "properties": { "level": { "enum": ["info", "warning", "verify"] }, "at": { "type": "string" }, "message": { "type": "string" } }
    }
  }
}
