{
  "schemaVersion": 1,
  "family": {
    "key": "textarea",
    "name": "Textarea",
    "description": "A multi-line text field whose invalid axis gives it a destructive border and ring, and whose state axis adds a focus ring or dims it when disabled."
  },
  "source": {
    "codeLibrary": "shadcn/ui",
    "adapter": "generic",
    "packages": {
      "@/components/ui/textarea": "sha256:82601c91ffc6c727d924162c78d7cb853114bcced4e2eb922a68ca12d4239c0f",
      "class-variance-authority": "0.7.1",
      "cn": "0.5.0",
      "radix-ui": "1.8.1",
      "react": "19.1.0",
      "react-dom": "19.1.0",
      "shadcn": "4.22.0",
      "tailwindcss": "4.3.3",
      "tw-animate-css": "1.4.0"
    },
    "files": {
      "app/globals.css": "sha256:15fd52bd462719c6469cb5978ece7a907e9558ac22050005abe8b865524e05e1",
      "components.json": "sha256:a39384a64384ceca47944248c992f4ab4d2ff565cfea3ff8daa89b2fc7b125e2",
      "components/ui/textarea.tsx": "sha256:82601c91ffc6c727d924162c78d7cb853114bcced4e2eb922a68ca12d4239c0f",
      "package-lock.json": "sha256:c083ebb3d38ac44b3c46ae3eb62de2086d548670e82bfbc4e523901c494c7ea9"
    },
    "snapshotId": "sha256:f867108029e85e1d5e6f2f62e1f1279c393470acc7169848842f6712f91a1be1"
  },
  "axes": [
    {
      "key": "invalid",
      "label": "Invalid",
      "default": "valid",
      "defaultSource": "aria-invalid absent: Textarea renders without it",
      "values": [
        {
          "key": "valid",
          "label": "Valid",
          "code": {},
          "css": ":not([aria-invalid=\"true\"])"
        },
        {
          "key": "invalid",
          "label": "Invalid",
          "code": {
            "aria-invalid": true
          },
          "css": "[aria-invalid=\"true\"]"
        }
      ]
    },
    {
      "key": "state",
      "label": "State",
      "canonical": true,
      "default": "enabled",
      "defaultSource": "canonical State axis (#6)",
      "values": [
        {
          "key": "enabled",
          "label": "Enabled",
          "code": {}
        },
        {
          "key": "focus",
          "label": "Focus",
          "code": null,
          "css": ":focus-visible"
        },
        {
          "key": "disabled",
          "label": "Disabled",
          "code": {
            "disabled": true
          },
          "css": ":disabled"
        }
      ]
    }
  ],
  "excluded": [],
  "selection": {
    "status": "draft",
    "omit": [],
    "expectedCount": 6,
    "approval": null
  },
  "anatomy": {
    "name": "Textarea",
    "type": "COMPONENT"
  },
  "properties": [],
  "layout": [
    {
      "match": {},
      "set": {
        "Textarea": {
          "direction": "row",
          "width": "fill",
          "height": "hug",
          "alignMain": "start",
          "alignCross": "start",
          "paddingTop": {
            "raw": 9,
            "level": "info",
            "reason": "derived: py-2 padding-block calc(var(--spacing) * 2) = 8px + 1px border (an inside stroke takes no layout space)"
          },
          "paddingRight": {
            "raw": 11,
            "level": "info",
            "reason": "derived: px-2.5 padding-inline calc(var(--spacing) * 2.5) = 10px + 1px border (an inside stroke takes no layout space)"
          },
          "paddingBottom": {
            "raw": 9,
            "level": "info",
            "reason": "derived: py-2 padding-block calc(var(--spacing) * 2) = 8px + 1px border (an inside stroke takes no layout space)"
          },
          "paddingLeft": {
            "raw": 11,
            "level": "info",
            "reason": "derived: px-2.5 padding-inline calc(var(--spacing) * 2.5) = 10px + 1px border (an inside stroke takes no layout space)"
          },
          "gap": {
            "token": "spacing-0"
          },
          "radius": {
            "token": "radius-lg"
          },
          "strokeWeight": {
            "raw": 1,
            "level": "info",
            "reason": "border: border-width 1px; the Foundations document has no stroke-width variable"
          },
          "strokeAlign": "inside"
        }
      }
    }
  ],
  "paint": [
    {
      "match": {},
      "set": {
        "Textarea": {
          "fill": {
            "token": "textarea-fill"
          },
          "stroke": {
            "token": "input"
          },
          "opacity": { "raw": 1, "level": "info", "reason": "no opacity utility" },
          "effects": []
        }
      }
    },
    {
      "match": {
        "invalid": "invalid"
      },
      "set": {
        "Textarea": {
          "stroke": {
            "token": "textarea-invalid-stroke"
          },
          "effects": [
            {
              "type": "drop-shadow",
              "spread": {
                "raw": 3,
                "level": "info",
                "reason": "aria-invalid:ring-3: a 3px ring (box-shadow 0 0 0 3px); no effect-spread variable"
              },
              "color": {
                "token": "textarea-invalid-effect"
              }
            }
          ]
        }
      }
    },
    {
      "match": {
        "state": "focus"
      },
      "set": {
        "Textarea": {
          "stroke": {
            "token": "ring"
          },
          "effects": [
            {
              "type": "drop-shadow",
              "spread": {
                "raw": 3,
                "level": "info",
                "reason": "focus-visible:ring-3: a 3px ring (box-shadow 0 0 0 3px); no effect-spread variable"
              },
              "color": {
                "token": "textarea-focus-effect"
              }
            }
          ]
        }
      }
    },
    {
      "match": {
        "state": "disabled"
      },
      "set": {
        "Textarea": {
          "fill": {
            "token": "textarea-disabled-fill"
          },
          "opacity": { "raw": 0.5, "level": "info", "reason": "disabled:opacity-50: opacity 50%; the Foundations document has no opacity variable" }
        }
      }
    },
    {
      "match": {
        "invalid": "invalid",
        "state": "focus"
      },
      "set": {
        "Textarea": {
          "stroke": {
            "token": "textarea-invalid-focus-stroke"
          },
          "effects": [
            {
              "type": "drop-shadow",
              "spread": {
                "raw": 3,
                "level": "info",
                "reason": "aria-invalid:ring-3: a 3px ring (box-shadow 0 0 0 3px); no effect-spread variable"
              },
              "color": {
                "token": "textarea-invalid-focus-effect"
              }
            }
          ]
        }
      }
    }
  ],
  "subComponents": [],
  "dependencies": {
    "families": [],
    "fonts": []
  },
  "figma": {
    "page": "Textarea",
    "componentSetName": "Textarea",
    "description": "shadcn/ui Textarea (components/ui/textarea.tsx).",
    "header": {
      "type": "Component",
      "title": "Textarea",
      "namespace": "@/components/ui/textarea"
    },
    "grid": {
      "columns": [
        "state"
      ],
      "rows": [
        "invalid"
      ]
    }
  },
  "code": {
    "framework": "react",
    "package": "@/components/ui/textarea",
    "component": "Textarea",
    "import": "import { Textarea } from \"@/components/ui/textarea\"",
    "alwaysEmit": []
  },
  "notes": [
    {
      "level": "info",
      "at": "components/ui/textarea.tsx",
      "message": "md:text-sm: Under a media query no tuple decides. Not carried."
    },
    {
      "level": "info",
      "at": "components/ui/textarea.tsx",
      "message": "placeholder:text-muted-foreground: Under a condition no tuple decides (a negation, or two states at once). Not carried."
    },
    {
      "level": "info",
      "at": "components/ui/textarea.tsx",
      "message": "text-base: Text utilities; text styles, the label and the anatomy beyond the root are not drafted yet (agent tier). Not carried."
    },
    {
      "level": "info",
      "at": "components/ui/textarea.tsx",
      "message": "disabled:cursor-not-allowed, field-sizing-content, min-h-16, outline-none, transition-colors: No Contract field carries these properties. Not carried."
    }
  ],
  "drafted": {
    "axes.invalid.label": {
      "by": "agent",
      "evidence": [
        "components/ui/textarea.tsx:L9 aria-invalid:border-destructive styles [aria-invalid=\"true\"]; prefixes aria-invalid, dark:aria-invalid"
      ],
      "fingerprint": "sha256:b514d8e286761c45e3cd9af0cfbca247bdf3f5800ce484252a12dca14b984ba0"
    },
    "family.description": {
      "by": "agent",
      "evidence": [
        "components/ui/textarea.tsx:L4 exports Textarea, rendered as <textarea>",
        "components/ui/textarea.tsx:L4 Textarea calls no cva; the Contract's axes: invalid (2), state (3)"
      ],
      "fingerprint": "sha256:5bb1bbe9bc896a5698b6bced9c2b0ff513d0177cfa8d41114de4acdb4a3e9827"
    },
    "figma.grid": {
      "by": "agent",
      "evidence": [
        "components/ui/textarea.tsx:L4 Textarea calls no cva; the Contract's axes: invalid (2), state (3)"
      ],
      "fingerprint": "sha256:5bb1bbe9bc896a5698b6bced9c2b0ff513d0177cfa8d41114de4acdb4a3e9827"
    }
  }
}
